{
  "version": "2026-06-28",
  "schema_version": 2,
  "sources": {
    "anthropic": {
      "url": "https://platform.claude.com/docs/en/about-claude/model-deprecations",
      "checked_at": "2026-06-28"
    },
    "openai": {
      "url": "https://developers.openai.com/api/docs/deprecations",
      "checked_at": "2026-06-28"
    },
    "google": {
      "url": "https://ai.google.dev/gemini-api/docs/deprecations",
      "checked_at": "2026-06-28"
    }
  },
  "aliases": {
    "claude-3-5-sonnet-latest": "claude-3-5-sonnet-20241022",
    "claude-3-5-haiku-latest": "claude-3-5-haiku-20241022",
    "claude-3-opus-latest": "claude-3-opus-20240229",
    "gemini-2.0-flash-latest": "gemini-2.0-flash",
    "gpt-4-turbo-preview": "gpt-4-0125-preview",
    "gpt-4-turbo-preview-completions": "gpt-4-0125-preview"
  },
  "models": {
    "claude-opus-4-8": {
      "provider": "anthropic",
      "status": "active",
      "replacement": null,
      "breaking_changes": [
        "temperature, top_p, and top_k return 400 on Claude Opus 4.7+ — omit these parameters"
      ],
      "migrate_url": "https://platform.claude.com/docs/en/about-claude/model-deprecations",
      "source": "anthropic",
      "notes": "Active; tentative retirement not sooner than 2027-05-28"
    },
    "claude-opus-4-7": {
      "provider": "anthropic",
      "status": "active",
      "replacement": null,
      "breaking_changes": [
        "temperature, top_p, and top_k return 400 — omit these parameters"
      ],
      "migrate_url": "https://platform.claude.com/docs/en/about-claude/model-deprecations",
      "source": "anthropic"
    },
    "claude-opus-4-6": {
      "provider": "anthropic",
      "status": "active",
      "replacement": null,
      "breaking_changes": [],
      "migrate_url": "https://platform.claude.com/docs/en/about-claude/model-deprecations",
      "source": "anthropic"
    },
    "claude-opus-4-5-20251101": {
      "provider": "anthropic",
      "status": "active",
      "replacement": null,
      "breaking_changes": [],
      "migrate_url": "https://platform.claude.com/docs/en/about-claude/model-deprecations",
      "source": "anthropic"
    },
    "claude-opus-4-1-20250805": {
      "provider": "anthropic",
      "status": "deprecated",
      "deprecated_at": "2026-06-05",
      "retired_at": "2026-08-05",
      "replacement": "claude-opus-4-8",
      "breaking_changes": [
        "temperature, top_p, and top_k are rejected on Claude Opus 4.7+ — remove before migrating"
      ],
      "migrate_url": "https://platform.claude.com/docs/en/about-claude/model-deprecations",
      "source": "anthropic"
    },
    "claude-opus-4-20250514": {
      "provider": "anthropic",
      "status": "retired",
      "deprecated_at": "2026-04-14",
      "retired_at": "2026-06-15",
      "replacement": "claude-opus-4-8",
      "breaking_changes": [
        "temperature, top_p, and top_k are rejected on Claude Opus 4.7+ — remove before migrating"
      ],
      "migrate_url": "https://platform.claude.com/docs/en/about-claude/model-deprecations",
      "source": "anthropic"
    },
    "claude-sonnet-4-6": {
      "provider": "anthropic",
      "status": "active",
      "replacement": null,
      "breaking_changes": [],
      "migrate_url": "https://platform.claude.com/docs/en/about-claude/model-deprecations",
      "source": "anthropic"
    },
    "claude-sonnet-4-5-20250929": {
      "provider": "anthropic",
      "status": "active",
      "replacement": null,
      "breaking_changes": [],
      "migrate_url": "https://platform.claude.com/docs/en/about-claude/model-deprecations",
      "source": "anthropic"
    },
    "claude-sonnet-4-20250514": {
      "provider": "anthropic",
      "status": "retired",
      "deprecated_at": "2026-04-14",
      "retired_at": "2026-06-15",
      "replacement": "claude-sonnet-4-6",
      "breaking_changes": [],
      "migrate_url": "https://platform.claude.com/docs/en/about-claude/model-deprecations",
      "source": "anthropic"
    },
    "claude-3-7-sonnet-20250219": {
      "provider": "anthropic",
      "status": "retired",
      "deprecated_at": "2025-10-28",
      "retired_at": "2026-02-19",
      "replacement": "claude-sonnet-4-6",
      "breaking_changes": [],
      "migrate_url": "https://platform.claude.com/docs/en/about-claude/model-deprecations",
      "source": "anthropic"
    },
    "claude-haiku-4-5-20251001": {
      "provider": "anthropic",
      "status": "active",
      "replacement": null,
      "breaking_changes": [],
      "migrate_url": "https://platform.claude.com/docs/en/about-claude/model-deprecations",
      "source": "anthropic"
    },
    "claude-3-5-haiku-20241022": {
      "provider": "anthropic",
      "status": "retired",
      "deprecated_at": "2025-12-19",
      "retired_at": "2026-02-19",
      "replacement": "claude-haiku-4-5-20251001",
      "breaking_changes": [],
      "migrate_url": "https://platform.claude.com/docs/en/about-claude/model-deprecations",
      "source": "anthropic"
    },
    "claude-3-haiku-20240307": {
      "provider": "anthropic",
      "status": "retired",
      "deprecated_at": "2026-02-19",
      "retired_at": "2026-04-20",
      "replacement": "claude-haiku-4-5-20251001",
      "breaking_changes": [],
      "migrate_url": "https://platform.claude.com/docs/en/about-claude/model-deprecations",
      "source": "anthropic"
    },
    "claude-mythos-preview": {
      "provider": "anthropic",
      "status": "deprecated",
      "deprecated_at": "2026-06-01",
      "retired_at": "2026-06-30",
      "replacement": "claude-mythos-5",
      "breaking_changes": [],
      "migrate_url": "https://platform.claude.com/docs/en/about-claude/model-deprecations",
      "source": "anthropic"
    },
    "claude-mythos-5": {
      "provider": "anthropic",
      "status": "active",
      "replacement": null,
      "breaking_changes": [],
      "migrate_url": "https://platform.claude.com/docs/en/about-claude/model-deprecations",
      "source": "anthropic",
      "notes": "Replacement for claude-mythos-preview"
    },
    "claude-3-5-sonnet-20240620": {
      "provider": "anthropic",
      "status": "retired",
      "deprecated_at": "2025-08-13",
      "retired_at": "2025-10-28",
      "replacement": "claude-sonnet-4-6",
      "breaking_changes": [],
      "migrate_url": "https://platform.claude.com/docs/en/about-claude/model-deprecations",
      "source": "anthropic"
    },
    "claude-3-5-sonnet-20241022": {
      "provider": "anthropic",
      "status": "retired",
      "deprecated_at": "2025-08-13",
      "retired_at": "2025-10-28",
      "replacement": "claude-sonnet-4-6",
      "breaking_changes": [],
      "migrate_url": "https://platform.claude.com/docs/en/about-claude/model-deprecations",
      "source": "anthropic"
    },
    "claude-3-opus-20240229": {
      "provider": "anthropic",
      "status": "retired",
      "deprecated_at": "2025-06-30",
      "retired_at": "2026-01-05",
      "replacement": "claude-opus-4-8",
      "breaking_changes": [],
      "migrate_url": "https://platform.claude.com/docs/en/about-claude/model-deprecations",
      "source": "anthropic"
    },
    "claude-3-sonnet-20240229": {
      "provider": "anthropic",
      "status": "retired",
      "deprecated_at": "2025-01-21",
      "retired_at": "2025-07-21",
      "replacement": "claude-sonnet-4-6",
      "breaking_changes": [],
      "migrate_url": "https://platform.claude.com/docs/en/about-claude/model-deprecations",
      "source": "anthropic"
    },
    "claude-2.0": {
      "provider": "anthropic",
      "status": "retired",
      "deprecated_at": "2025-01-21",
      "retired_at": "2025-07-21",
      "replacement": "claude-opus-4-8",
      "breaking_changes": [],
      "migrate_url": "https://platform.claude.com/docs/en/about-claude/model-deprecations",
      "source": "anthropic"
    },
    "claude-2.1": {
      "provider": "anthropic",
      "status": "retired",
      "deprecated_at": "2025-01-21",
      "retired_at": "2025-07-21",
      "replacement": "claude-opus-4-8",
      "breaking_changes": [],
      "migrate_url": "https://platform.claude.com/docs/en/about-claude/model-deprecations",
      "source": "anthropic"
    },
    "gpt-5.5": {
      "provider": "openai",
      "status": "active",
      "replacement": null,
      "breaking_changes": [],
      "migrate_url": "https://developers.openai.com/api/docs/deprecations",
      "source": "openai"
    },
    "gpt-5.4-mini": {
      "provider": "openai",
      "status": "active",
      "replacement": null,
      "breaking_changes": [],
      "migrate_url": "https://developers.openai.com/api/docs/deprecations",
      "source": "openai"
    },
    "gpt-5-2025-08-07": {
      "provider": "openai",
      "status": "deprecated",
      "deprecated_at": "2026-06-11",
      "retired_at": "2026-12-11",
      "replacement": "gpt-5.5",
      "breaking_changes": [],
      "migrate_url": "https://developers.openai.com/api/docs/deprecations",
      "source": "openai"
    },
    "gpt-5-mini-2025-08-07": {
      "provider": "openai",
      "status": "deprecated",
      "deprecated_at": "2026-06-11",
      "retired_at": "2026-12-11",
      "replacement": "gpt-5.4-mini",
      "breaking_changes": [],
      "migrate_url": "https://developers.openai.com/api/docs/deprecations",
      "source": "openai"
    },
    "gpt-5.2-chat-latest": {
      "provider": "openai",
      "status": "deprecated",
      "deprecated_at": "2026-05-08",
      "retired_at": "2026-08-10",
      "replacement": "gpt-5.5",
      "breaking_changes": [],
      "migrate_url": "https://developers.openai.com/api/docs/deprecations",
      "source": "openai"
    },
    "gpt-5.3-chat-latest": {
      "provider": "openai",
      "status": "deprecated",
      "deprecated_at": "2026-05-08",
      "retired_at": "2026-08-10",
      "replacement": "gpt-5.5",
      "breaking_changes": [],
      "migrate_url": "https://developers.openai.com/api/docs/deprecations",
      "source": "openai"
    },